model,feedback,score
claude-base,"The summary effectively captures the main points of the text, highlighting key aspects such as the score, the absence of important players, the poor shooting performance, and the expectation of improvement in the actual tournament. However, there are minor grammatical errors present in the summary, such as missing articles before ""derrota"" and ""ventaja."" These errors, although they do not significantly hinder the overall understanding, detract from the quality of the summary according to the score rubric's criteria. Despite this, the response is coherent and maintains the original text's flow, thus not straying far from the standard expected. It is also worth noting that the language variety and dialect are used appropriately throughout the summary. Based on these observations and the score rubric, it can be concluded that the summary is of good quality, with only a few grammatical errors. So the overall score is 4. [RESULT] 4",4
claude-base,"The summary captures the essence of the original text without errors in grammar or spelling, maintaining a high level of language fluency. The sentences are clearly structured and the use of language is natural and appropriate. Each key point from the original text is concisely presented, providing an informative yet succinct summary. The response is also free from the use of multiple language varieties or dialects, which might disrupt the reading experience. The summary flows smoothly, reflecting a clear understanding of the content. It is evident that the response adheres to the score rubric's requirements, with no notable linguistic mistakes or awkward word combinations that might impede comprehension. Therefore, the summary is well-written and aligns with the standards of the language used. 
[RESULT] 5",5
claude-base,"The response provided an adequate summary of the text. It addressed the key issues, such as the disagreement over the number of pisos turísticos, the debate among residents, owners, and long-term renters, and the impact on the community's life. However, there were minor grammatical errors that made the text slightly less coherent than the reference response. For instance, the phrase ""La situación ya había llegado al límite"" could have been more accurately expressed as ""The situation had reached its limit."" Similarly, ""Tres Administraciones y un problema sin resolver"" might have been better as ""Three Administrations and an unresolved problem."" These errors do not significantly hinder the overall understanding but are enough to slightly affect the fluency of the text. Nonetheless, the response effectively communicated the main points of the text, and the language was mostly consistent with the original content. So the overall score is 4. [RESULT] 4",4
claude-base,"The summary is grammatically correct and adheres to the conventions of the English language. It provides a succinct overview of the proposed changes in rugby norms, highlighting the central issue of player safety and the goal of increasing the sport's appeal. However, there is room for improvement in terms of depth and detail. For instance, while it correctly states that World Rugby is considering prohibiting certain types of tackles, it doesn't explain the reasoning behind this decision. Additionally, it fails to mention that some changes will not be implemented until after the 2023 World Cup. Furthermore, while the summary mentions the potential shift to a more open and exciting style of play, it does not provide examples or elaborate on how this would manifest on the field. These aspects would add richness and clarity to the summary, enhancing the reader's understanding of the subject matter. Therefore, based on the rubric which values fluency, coherence, and the correct usage of language, the response demonstrates a satisfactory level of proficiency, but it could benefit from additional depth and detail to improve its overall quality. 
[RESULT] 4",4
claude-base,"The summary is quite well written, with good use of grammar and punctuation, adhering closely to the language standards. There are minor issues like the phrase ""Se ha mostrado por su competitividad y liderazgo en las pruebas,"" which could be improved by including ""particularly in Supervivientes."" Additionally, there are some areas where the summary could be more specific. For example, the explanation of the relationship with Paulina Rubio lacks detail about their courtship and separation. However, the overall structure and content are sufficiently coherent, which meets the criteria for a score of 4 according to the rubric. Given that the response does not contain significant grammatical errors or mixing of language varieties, the summary is mostly accurate and reads comfortably. Therefore, the score is 4. [RESULT] 4",4
claude-base,"The summary provided is grammatically sound, with no obvious grammatical errors. However, it lacks the detail and depth found in the original text. Key elements such as the launch time, the concept of the rover Pragyan, and the intended duration of the mission's operations were missing. While it generally captured the main points, it did not delve into specifics that contribute to the full understanding of the subject matter. Therefore, considering the criteria of fluency and grammar, the summary meets the basic requirements but does not fully align with the higher standards of providing a thorough and well-structured summary. Consequently, it would receive a score of 4, given that it contains few grammatical errors and presents a coherent summary albeit with less detail than ideal. 
[RESULT] 4",4
claude-base,"Upon evaluating the response against the provided score rubric, it becomes evident that there is a clear adherence to the grammatical and linguistic conventions for the language. The sentences are structured well, and there are no obvious grammatical errors or spelling mistakes, thus ensuring that the text is readable without any difficulties. Moreover, the language variety/dialect is maintained throughout the summary, resulting in a coherent and natural-sounding text. Therefore, based on the score rubric's focus on grammar, fluency, and linguistic variety, the response demonstrates a high level of quality. The response aptly encapsulates the key points of the original text while maintaining a fluent narrative, ensuring that all important information is accurately conveyed. This attention to detail and linguistic competence in constructing the summary are in line with the requirements of the rubric, hence the score of 5. 
[RESULT] 5",5
claude-base,"The response is grammatically sound and does not mix language varieties/dialects in an unnatural or uncomfortable way. It accurately summarizes the key points of the original text without introducing grammatical or spelling errors. The response, however, lacks the depth found in the reference answer. It provides a brief overview of the key points but misses some details that could enrich the summary, such as the date of the separation announcement, the timing of their Instagram posts, and the specific days related to the revelation of the separation. Nevertheless, based on the provided score rubric focusing solely on grammar and fluency, the response is well-written and meets the criteria for a score of 5. 
[RESULT] 5",5
claude-base,"The response provides a summary of the Festival of Cine Judío de Barcelona's 21st edition. It captures the essence of the event by highlighting the diversity of the films in terms of themes, genres, and the experiences they depict. The summary is grammatically sound and does not mix language varieties or dialects. It maintains a coherent flow and effectively summarizes the festival's program, including its focus on the Jewish community, the retrospective of Ruth Beckermann, and the various conflicts and historical experiences that the films represent. Furthermore, the response highlights the variety of films, ranging from biopics to comedies, and it gives examples of some of the films that will be screened during the festival. The summary aligns with the instruction provided, and it is well-written, respecting the conventions of the language in use. Therefore, according to the score rubric, which emphasizes fluency and grammatical correctness, the summary is of high quality, free of significant errors or unnatural language usage. 
[RESULT] 5",5
claude-base,"The summary effectively condenses the key points of the original text and presents them coherently. It maintains a consistent level of detail and provides a balanced overview of the sharenting phenomenon. Furthermore, the summary does not contain any significant grammatical errors, and the language used is appropriate for the context. However, there are some minor grammatical issues that slightly detract from the overall fluency of the text. These errors are not critical, but they are noticeable enough to affect the smoothness of the reading experience. In conclusion, while the summary is well-written and largely accurate, the presence of minor grammatical issues reduces its score slightly. 
[RESULT] 4",4
claude-base,"The response provided is generally coherent, and the language used is appropriate for a summary of a news article. However, there are minor issues that affect the overall fluency of the summary. For instance, there is a lack of detail regarding the specific criticisms from the oposition and the exact nature of Sánchez's agenda with the colectives. Additionally, the use of phrases like ""tienes un resumen"" and ""los presidentes del Gobierno español"" is less precise than it could be, potentially leading to slight confusion for the reader. Despite these issues, the response remains largely free of grammatical errors and offers a clear and concise summary of the main points from the text. Therefore, according to the score rubric, the response would receive a score of 4 due to the presence of a few minor grammatical errors and the inclusion of some less precise language. However, the errors and the less precise language do not significantly impede the reader's understanding of the summary, thus not warranting a lower score. So the overall score is 4. [RESULT] 4",4
claude-base,"The response effectively summarizes the project of fiscal orderings in Barcelona with some grammatical errors. For instance, ""the proyecto of orderanzas fiscales"" should be ""the project of fiscal orderings."" Furthermore, the use of phrases like ""su proyecto de ordenanzas fiscales"" instead of ""the alcaldesa's project"" deviates from the more commonly used grammar, causing an awkward mix of languages. The summarization maintains the main points of the original text, which are important to understanding the key aspects of the new fiscal orderings in Barcelona. The response addresses the environmental tax, the variable parking tariffs based on vehicle emissions, the intention to reduce contamination and the number of cars in the city, the negotiations with the opposition, the utilization of new devices to monitor and regulate parking, and the total number of regulated parking spaces. However, the mix of language varieties and the presence of grammatical errors somewhat affect the fluency of the summary. Therefore, while the summary captures the essence of the project, it falls short in terms of grammatical correctness and language coherence. 
[RESULT] 3",3
claude-base,"The response adequately summarizes the original text, maintaining a good level of fluency. It correctly identifies the main points: the engagement of Beatriz de York with Edoardo Mapelli Mozzi, the delay in details about the wedding, Mozzi's background, and the overall mood of happiness for the engagement. However, there are some minor issues with grammar and sentence structure. For instance, the phrase ""es una hija maravillosa que ha encontrado su amor"" should be ""es una hija maravillosa que ha encontrado su amor y su compañero completamente devoto"" to properly capture the sentiment being conveyed. Furthermore, while the summary is mostly clear and understandable, it could benefit from a bit more detail in certain areas, such as the duration of the couple's relationship and the reaction of the royal family. Overall, while the response is well-written and mostly free of errors, there is still room for improvement in terms of detail and fluency. Therefore, the response meets the criteria for a score of 3. 
[RESULT] 3",3
claude-base,"The summary provided has been crafted well in terms of clarity, and the sentences are grammatically correct, adhering to the standard for the English language. There are no obvious spelling mistakes or awkward linguistic choices that detract from the overall coherence of the text. Additionally, the summary's narrative flow is logical, and it successfully condenses the essence of the original story while maintaining the key points. This summary effectively communicates the critical elements of the text, including the cessation of the investigation, the allegation of sexual violence, the potential impact on Neymar's career, and the implications for the football player's future plans. Hence, the summary meets all the criteria set forth in the score rubric, which calls for high standards of fluency, grammatical correctness, and coherence. The summary does not mix language varieties or dialects in an unnatural way, ensuring a cohesive and easy-to-understand summary. So the overall score is 5. 
[RESULT] 5",5
claude-base,"The response provides a concise summary of the text but there are minor issues that affect the overall fluency. For example, the phrase ""si otorgan su confianza menos de 374 de sus miembros"" could be phrased more naturally as ""if the majority of the parliamentarians vote against her."" Similarly, the sentence ""El artículo argumenta que el Parlamento Europeo debería considerar cuidadosmente estas cuestiones antes de votar sobre su nombramiento"" could benefit from a smoother transition to the conclusion. Additionally, the response occasionally uses a less formal tone, which slightly undermines the gravity of the topic being discussed. These are minor issues and the overall content and understanding of the text are maintained. However, these small lapses in fluency prevent the response from achieving a perfect score. So the overall score is 4. [RESULT] 4",4
claude-base,"The summary provided shows a good understanding of the text and covers the key plot points and character references. The response demonstrates an adequate level of fluency and grammatical accuracy. However, there are minor errors such as the omission of the director's first name, Hèctor Claramunt, which could lead to slight confusion about the credits of the play. Additionally, the description of the play as a ""comedy romanticica"" could have been more precise by including ""tragedy"" to describe the twist in the narrative, as it is mentioned in the text. Nevertheless, these are minor details that do not significantly impact the overall quality of the summary. Therefore, based on the rubric, the response is mostly well-written, with only a few minor grammatical errors. So the overall score is 4. [RESULT] 4",4
claude-base,"Upon reviewing the provided summary of ""The King"", it is evident that it adheres to the requirements of grammatical accuracy and coherence in language. The summary is succinct and encapsulates the essence of the film while avoiding any significant errors. Each sentence flows logically, creating a cohesive narrative. Furthermore, the response maintains a consistent tone and style, effectively conveying the key aspects of the film without unnecessary details or repetitive language. This level of clarity and correctness is in line with the expectations for a well-written summary, as per the rubric. Therefore, based on the absence of grammatical or spelling errors and the coherent use of the language, the summary fulfills the criteria set by the rubric. 
[RESULT] 5",5
claude-base,"The provided summary has an overall high level of fluency and adherence to grammatical conventions. However, there are minor issues that impact the overall clarity and accuracy. For instance, in point 1, ""la principal fuente de NO₂"" could be more precise by specifying that this source is vehicular traffic. Moreover, point 2 is accurate but lacks the mention of ""los compuestos orgánicos volátiles,"" which are part of the precursors of ozone. These omissions do not greatly affect the understanding but could lead to slight confusion or misinterpretation. On the other hand, the structure and content of the summary are mostly coherent, well-written, and closely aligned with the source text, effectively summarizing the main points and key findings. Thus, based on the grammatical and spelling quality, the summary is commendable but not flawless. So the overall score is 4. [RESULT] 4",4
claude-base,"Upon examining the summary, there are a few grammatical and spelling errors that slightly impact the fluency of the text. For instance, the phrase ""inconsciente de una corriente"" could have been better articulated as ""influenced by a trend,"" and the sentence ""Hemos incluido un capítulo con el material de cocina necesario,"" could have been more precise and informative. Moreover, there is a lack of coherence and connection between the elements presented in the summary. Although the core ideas are represented, the way they are linked together could be improved to provide a smoother and more comprehensive summary. Therefore, while the response largely meets the requirements of the score rubric, it falls short of being entirely error-free and perfectly coherent, thus meriting a score of 3. 
[RESULT] 3",3
claude-base,"The summary is overall well-written with only a few minor issues. The language used is appropriate for the context and avoids any formatting problems or noticeable spelling errors. However, there is a slight discrepancy in the phrasing of the section regarding the challenges faced by the extradition request. The original text indicated that ""experts legally pointed out"" potential obstacles, while the summary states that ""experts legal scholars pointed out."" This small but significant change could impact the perception of the summary's adherence to the original text. Additionally, while the summary is generally accurate, the simplification of complex legal discussions in this context might affect the overall clarity and comprehensiveness of the summary. Nevertheless, these issues do not detract significantly from the overall quality of the response. So the overall score is 4. 
[RESULT] 4",4
claude-base,"The summary of the text is mostly grammatically correct and follows a logical flow. However, there are a few minor issues that detract from the overall fluency of the response. For example, there is a sentence construction error in point 4, where the word ""modelos"" should have been ""models"". Moreover, the transition between points 2 and 3 could be smoother, as the response seems to abruptly shift from the focus on the system olfativo to the role of mathematical techniques. Additionally, the final point, which is meant to summarize the broader implications of the study, could be expanded to reflect a better understanding of the text's theme. Nevertheless, these shortcomings are relatively insignificant compared to the depth and accuracy with which the main points of the text are conveyed. So the overall score is 4. [RESULT] 4",4
claude-base,"This response demonstrates a good level of fluency, presenting a well-structured summary without significant grammatical errors. However, there are minor mistakes, such as the contraction ""yo"" instead of ""I"" in the introductory paragraph, which slightly affects the clarity of the sentence. Additionally, the phrase ""ya quizás venía una vez al mes"" is slightly awkward, as it could be more grammatically accurate with ""ya quizás venía una vez al mes o una vez al trimestre o una vez al año."" Despite these minor issues, the summary effectively communicates the key points of the original text, presenting a clear picture of Fernando Navarro's life and work. It is written in the appropriate language, following conventional grammar and spelling. So, while there are a few grammatical errors, they are minor and do not significantly detract from the overall fluency of the response. Therefore, the summary meets the criteria for a score of 4, as it contains few grammatical errors. 
[RESULT] 4",4
claude-base,"This response effectively summarizes the key points of the text, demonstrating a good understanding of the subject matter. It manages to encapsulate the main points about the adquisition, the reasons behind it, and the future objectives of the new company. However, the language used is somewhat informal and lacks the professional tone expected in a business summary. Additionally, there are a few minor grammatical errors and a slight inconsistency in sentence structure. These issues prevent the response from achieving a perfect score. Nonetheless, the content is clear and coherent, making it accessible to the reader. Based on these observations and considering the score rubric's focus on grammatical and spelling accuracy, the summary receives a score of 4. [RESULT] 4",4
claude-base,"The response effectively summarizes the text, demonstrating a good understanding of the subject matter. It presents key information about the increase in international tourists to Spain, focusing on the figures for June and the overall picture for the first semester. The summary is also coherent and well-structured, adhering to the grammatical and spelling conventions of the language. There are no major errors, and the language used is appropriate for the topic. In terms of fluency, the sentences are clear and convey the necessary information without issue. Therefore, based on the criteria set by the score rubric, the summary is well-written, grammatically accurate, and contains no formatting or language variety errors. 
[RESULT] 5",5
claude-base,"The response does not adhere to the instruction as it lacks a detailed summary of the provided text. It merely provides a brief and somewhat unnatural overview without delving into the intricacies of the text as requested. Moreover, it mixes language varieties in an unnatural and uncomfortable way, which could be confusing to the reader. There are also some grammatical errors and the response falls short of the required detail and depth. The response lacks the nuanced details such as the specific impact of the film ""Game Change,"" Lisa Ann's role in the politics and media, and the broader cultural context. In addition, the summary fails to mention the significant event of Sarah Palin's divorce as a catalyst for the renewed interest in her life story and Lisa Ann's work. These omissions and the overall lack of detail make the summary significantly less effective than the reference answer. Therefore, based on the score rubric, the response is less coherent, lacks fluency, and contains grammatical errors. Hence, the score is 2. [RESULT] 2",2
claude-base,"In evaluating the response, the primary focus is on the grammar and spelling of the summary. The summary provided is accurate, well-structured, and without any grammatical or spelling errors, reflecting the coherence expected of the language variety used. Each sentence in the summary flows naturally, contributing to the overall fluency. The summary is a concise representation of the original text, maintaining its essence without compromising the language quality. Additionally, the response demonstrates a clear understanding of the task at hand, summarizing the key elements of the original text while effectively communicating the severity of the incidents and their impact on the rail system and the public. Therefore, based on the provided rubric and the absence of any significant grammatical errors, the response is deemed to be of the highest quality. 
[RESULT] 5",5
claude-base,"The response provided here adequately captures the essence of the text without being overly lengthy or deviating from the subject matter. The summary follows grammatical and spelling conventions well, with no apparent grammatical errors, thus meeting the criteria for fluency. The sentences are also well-structured and coherent, which aids in the overall flow and understanding of the text. Furthermore, there are no instances where the language used feels out of place or unnatural, indicating a strong grasp of the language and its usage in this context. The response effectively summarizes the key points from the text, including Ignacio's achievements, the importance of learning latin, and the viewpoints of the other participants in the meeting. It avoids unnecessary details and focuses on the most important elements of the text, thereby providing a clear and concise summary. The response also succeeds in maintaining a consistent and professional tone throughout, which further supports its clarity and readability. Given these aspects, it is evident that the response meets the highest standards of fluency and coherence, and is therefore fully deserving of a score of 5 according to the score rubric. 
[RESULT] 5",5
