model,feedback,score
gpt4o-cot,"The response effectively summarizes the significant issues faced by the red ferroviaria catalana, including the financial implications of the sabotages, the risks posed to passengers and workers, and the growing impact on the infrastructure. It also mentions the high rate of incidences in Girona and specifically addresses the issue of the Rodalies network. However, it fails to cover all aspects presented in the original text, such as the precise incidents mentioned and the broader context of the protests against the court's decision. Despite these omissions, the response is well-written and largely free of grammatical errors. Therefore, while it does not reach the highest standard of fluency and comprehensive coverage of all details presented in the text, it nonetheless maintains a high level of grammatical accuracy and coherence. 

[RESULT] 4",4
gpt4o-cot,"This response exhibits excellent command of the Spanish language, and the quality of the individual sentences is quite high. The response clearly presents the information provided in the original text without mixing language varieties or dialects in an unnatural or uncomfortable manner. It's clear and free from grammatical errors, which allows readers to understand the content without difficulty. The choice of words and phrases contributes to a coherent narrative that maintains the essence of the original text. Furthermore, the use of punctuation and sentence structure is correct, enhancing the overall readability and fluency of the response. So, in accordance with the score rubric that emphasizes fluency and grammar, this response earns a score of 5 as it demonstrates no significant grammatical errors and maintains a coherent use of the Spanish language. 
[RESULT] 5",5
gpt4o-cot,"The response provided a concise summary of the text without any significant grammatical errors. The language used was coherent and did not exhibit any mix-ups of dialects or a less natural flow, which is critical in maintaining readability and comprehensibility. Furthermore, the sentence structure and punctuation were appropriate and followed standard English grammar, enhancing the overall fluency of the response. There were minor oversights, such as the lack of detail in discussing the challenges faced by Clara and the absence of explicit mention of the specifics of the initiative for first-time infant care workers, but these did not detract significantly from the overall quality of the summary. Therefore, according to the score rubric, the response adequately addresses the fluency criterion, demonstrating a proficient command of the language. So the overall score is 5. 
[RESULT] 5",5
gpt4o-cot,"The response provides a concise summary of the information presented in the text. However, it includes minor grammatical errors and a slight mix of language varieties, which is less natural than ideal. Despite these issues, the overall flow of the response remains relatively smooth, and the key points are effectively communicated. The summary could benefit from more polished sentence structure and better use of language conventions to achieve a more natural and coherent narrative. Although the errors present are not significant enough to detract greatly from the overall message, they do slightly detract from the quality of the summary. So the overall score is 3. [RESULT] 3",3
gpt4o-cot,"The provided response contains several grammatical errors, making it difficult to read. For instance, there are incorrect verb forms such as ""ha generado"" instead of ""has caused"", and ""Trabajan para controlar las llamas"" which should be ""Working to control the fires"". The summary also omits the details of the incident, such as the time when the fire broke out and the location of the fire-starting company, which makes it less informative. Moreover, the inclusion of irrelevant information like the social media pages of the news organization at the end distracts from the main summary. These aspects indicate a lack of fluency and a disregard for grammatical accuracy. Consequently, it doesn't meet the standards of a well-written summary in terms of grammar and spelling, according to the score rubric. Therefore, the summary would receive a score of 1 due to its numerous grammatical errors and lack of pertinent information. 
[RESULT] 1",1
gpt4o-cot,"The summary provided is coherent and follows the language and grammatical conventions expected. It gives a brief overview of the events described in the original text, effectively summarizing key points such as the actors' appearance, the context of their visit, the nature of the Nespresso ad, and their respective backgrounds. The writing is fluid and there are no obvious grammatical errors, which allows for easy comprehension.

However, the summary could benefit from including more specific details to provide a more thorough overview of the events. For example, mentioning the specific localization in Tenerife for the actor's next film, Good Morning, Midnight, would provide additional context to the summary. Despite this, the summary does not mix language varieties or dialects in an uncomfortable way, nor does it contain any noticeable grammatical mistakes.

The variety of language used in the summary is appropriate for the summary's purpose and it maintains consistency throughout the text. This alignment with the language and grammar conventions, along with the fact that the summary does not introduce any unnatural or uncomfortable language variety or dialect, ensures that the summary adheres to the expected standards of fluency and grammar.

In conclusion, while the summary captures the essence of the original text, it falls short in providing a comprehensive summary that covers all the relevant details. Nonetheless, it meets the criteria of being well-written, grammatically correct, and maintaining a natural flow. Therefore, the summary is assessed to be of good quality, reflecting the majority of the criteria specified in the score rubric. 
[RESULT] 4",4
gpt4o-cot,"The summary is grammatically correct and does not contain any significant spelling errors, thus meeting the criteria for fluency and grammatical accuracy. It provides a coherent narrative that captures the essence of the case against the magistrate, Gilmar Mendes. The summary maintains a formal tone appropriate for discussing a legal matter, indicating that the text was written in the correct language variety without any language mixing or awkward usage. It also addresses the key points raised in the instruction, such as the intentions of the fiscal team and their possible overstepping of their legal boundaries. The summary effectively condenses the complex events into a concise yet comprehensive account, which is crucial for meeting the requirements of the task. Therefore, the summary meets all aspects of the score rubric for fluency, grammar, and language usage, thereby justifying a score of 5. 
[RESULT] 5",5
gpt4o-cot,"The response provides a good summary of the original text. However, it falls short in capturing the entire context, especially in describing the varying profiles of the foreign investors. Additionally, while the summary is grammatically correct, it lacks the comprehensive detail provided in the reference response. For instance, the response misses out on discussing the regional preferences of foreign investors and the specific challenges faced by non-European buyers when seeking a mortgage. These omissions result in a less thorough summary. Moreover, the choice of words could be more varied to provide a richer description of the scenarios presented. Despite these shortcomings, the response is still relatively well-written, with only minor issues noted in terms of the quality of the sentences. Therefore, while the response meets the basic requirements of the score rubric, it does not fully achieve the high level of fluency and detail expected in a score 5 response. So the overall score is 4. [RESULT] 4",4
gpt4o-cot,"This summary maintains a high degree of fluency and accuracy in the use of the Spanish language, making it easy to read and understand. The sentences are constructed correctly, with proper capitalization and a clear flow that aligns with the original text. There are no grammatical errors or awkward language mixes that would distract the reader or impede their comprehension. Additionally, the language is coherent and appropriate for the context, which is crucial for maintaining a high level of fluency. Therefore, in accordance with the scoring rubric, this summary demonstrates a perfect understanding of the language and text, without any grammatical or spelling errors. It successfully summarizes the original text while adhering to the conventions of grammar and spelling, thereby justifying a score of 5. 
[RESULT] 5",5
gpt4o-cot,"The summary is well constructed, adhering to the principles of correct language use. The grammar and spelling are impeccable, making it easy to read. The structure and content of the summary reflect a high level of understanding and summarization skills. It manages to encapsulate the essence of the original text while maintaining a concise and focused approach. However, it falls slightly short in terms of capturing the complete atmosphere and emotional impact of the show, compared to the original text. This minor oversight in encapsulating the show's ambiance slightly reduces the overall effectiveness of the summary. Despite this, the summary remains engaging and faithful to the original content, thus aligning closely with the score rubric's criteria for a high-quality summary. Therefore, based on the score rubric, the summary is rated as excellent. 
[RESULT] 4",4
gpt4o-cot,"The summary is generally well-written, with no obvious grammatical or spelling errors. However, it could benefit from a bit more detail regarding the nature of the protest and the events leading up to it, such as the specific circumstances involving the BBVA and Anticipa. Additionally, the use of phrases like ""sus gritos e insultos"" and ""impide el trabajo normal de los funcionarios"" is somewhat forced and may be difficult for some readers to understand. Overall, while the summary is accurate and informative, it could be improved by incorporating more nuanced and natural language, which would enhance its readability and comprehensibility. So the score is 3. 
[RESULT] 3",3
gpt4o-cot,"The response given accurately summarizes the content of the text, maintaining a high level of fluency throughout. The response is well written and does not contain any formatting problems, capitalization errors, or obvious ungrammatical sentences, which are all criteria in the score rubric. It is clear that the writer has a good grasp of the language, as the summary is coherent and easy to understand, which aligns with the criteria for a score of 5. Moreover, the summary accurately encapsulates the key points of the original text, providing a clear overview without losing any important details. This shows that the response is carefully crafted to ensure that all key information is included and that the summary flows naturally, which further supports its fluency and overall quality. So the overall score is 5. [RESULT] 5",5
gpt4o-cot,"The summary provided effectively condenses the main issues discussed in the text: the overpopulation of dogs, the constant noise, and the growing insecurity in Barcelona. The structure of the summary is coherent and follows the language conventions. However, it contains minor grammatical errors such as ""No podemos ni queremos prohibir que la gente se divierta"" where ""ni queremos"" should be ""neither do we want to"", making it a slight deviation from perfect grammar. Also, there are a few instances where the language could be more polished, for example, in phrases like ""Yo preferí tantear el terreno con un asunto menor"" which could be better expressed as ""I preferred to discuss a less severe issue"". Despite these slight imperfections, the overall fluency and coherence of the summary do not suffer from significant grammatical or syntactical errors. 

Considering these points, the summary is sufficiently clear and understandable for the reader, maintaining the essence of the original text while addressing the three main problems in a structured manner. The response is quite close to the desired quality as outlined in the score rubric, hence it achieves a score of 4. The response could be improved slightly to achieve a perfect score. 
[RESULT] 4",4
gpt4o-cot,"The summary provided is quite well-written and adheres to the grammatical and spelling conventions for the language. The sentences flow logically and there are no significant errors that hinder readability. However, a closer examination reveals a minor inconsistency regarding the reference to 'pipeños', which could have been more accurately translated as 'field wines' rather than the generic term 'bush wines'. Additionally, the mention of specific winemakers and their contributions to the wine scene adds depth to the narrative but lacks the detail and context found in the original text, such as the specific wineries they lead or the cultural and historical aspects that surround the wine industry. Despite these shortcomings, the overall quality of the summary is commendable and aligns closely with the criteria of the score rubric. So the score is 4. [RESULT] 4",4
gpt4o-cot,"The summary effectively encapsulates the key elements of the text provided, with a strong focus on the financial implications and strategic intentions behind PRISA's decision to sell a significant portion of Media Capital to Cofina. It also emphasizes the broader context in which this decision was made, considering the group's need to reduce debt and concentrate on its more strategic interests. This coherence and relevance in summarizing are evident in the absence of any major grammatical errors or language inconsistencies. The narrative flows logically from one point to the next, providing a comprehensive and concise overview of the situation. Therefore, based on the score rubric's emphasis on fluency and grammatical correctness, this response is considered to be superior in its execution of these criteria. 
[RESULT] 5",5
gpt4o-cot,"The summary provided is articulate and coherent, with correct grammar and language use. It successfully summarizes the key points of the original text, including the removal of José Luis Pérez Caminero as the director of the club, the financial crisis facing the club, and the steps being taken to manage the crisis. It also touches on the poor relationship between Caminero and the proprietor, Jeque Al-Thani. However, the response could be more comprehensive by mentioning the club's failure to achieve its goals of promoting players and incurring unnecessary costs. It also fails to capture the extreme measures the club had to take, such as offering to pay five million euros to LaLiga, which was a vital detail from the original text. The summary does not reflect the severity of the crisis and the lack of player signings and their impact on the club's season. Despite these omissions, the summary remains clear and grammatically sound. So the overall score is 4. [RESULT] 4",4
gpt4o-cot,"The response maintains a high level of fluency and accuracy in terms of grammar and spelling, effectively summarizing the complex political situation in Catalonia. There are no formatting issues or errors in the response that would make it difficult to read or understand. The language used in the summary is coherent and appropriate for the context, reflecting a nuanced understanding of the subject matter. The summary also adeptly captures the essence of the ongoing conflict and the stances of the involved parties, providing a clear and concise overview of the situation. Therefore, according to the score rubric, the response meets all the criteria for a high score due to its fluent and error-free construction. 
[RESULT] 5",5
gpt4o-cot,"The summary of the text is articulate and coherent, with no significant grammatical errors. It captures the essence of Disney's dominance in the entertainment industry and its strategic acquisitions. However, there are minor issues such as missing articles and slight awkwardness in sentence structure. This is particularly noticeable in the opening sentence, which could be improved for better readability. Nonetheless, these issues do not detract significantly from the overall quality of the summary. So the overall score is 4. [RESULT] 4",4
gpt4o-cot,"The response effectively summarizes the text, capturing the main points such as the disappointment felt by the artists and intellectuals, the blame placed on both PSOE and UP, and the sentiment of the failure to establish a progressive government. However, there are minor grammatical errors and the language could have been more formal and cohesive. For instance, ""percibido como una oportunidad perdida"" could have been expressed as ""perceived as a missed opportunity."" Similarly, ""Zahara, Berzosa, y otros"" could have been better structured to enhance the flow of information. While these are slight deviations from the ideal, they do impact the overall fluency and clarity of the summary. Despite these issues, the response is coherent and informative, providing a concise overview of the text's content. So, considering the grammatical quality and the use of language, the response receives a score of 4. 
[RESULT] 4",4
gpt4o-cot,"The summary presents a clear and coherent overview of the subject matter, without any grammatical or spelling errors. The language used is appropriate for a summary of this nature, maintaining consistency in style throughout the text. The content is structured logically, facilitating understanding of the different caves and their unique characteristics and exploration records. This organization of information contributes to the clarity and readability of the summary. Additionally, the summary remains within the expected boundaries of length, which further enhances its quality. The grammatical correctness and overall coherence in the summary adhere to the criteria outlined in the score rubric, thus meeting the highest standard set for performance. 
[RESULT] 5",5
gpt4o-5w1h,"La respuesta está compuesta por diferentes frases que hacen mención de las noticias, pero no se ha encadenado en un resumen completo. La respuesta posee una estructura dispersa que afecta la fluidez del texto. Además, existen varios tipos de gramatical errors y una mezcla de dialectos que afecta la lectura. Esto contraviene el criterio de la rubrica que pide que el texto no contenga ninguna gramática o ortografía incorrecta y que el dialecto usado debe ser coherente.

Por example, ""Qué: La selección española de baloncesto sufrió su segunda derrota consecutiva en la preparación para el Mundial, esta vez contra Rusia, mostrando un rendimiento pobre en tiros y con muchas pérdidas de balón."" This sentence lacks proper grammar and contains several ungrammatical structures. Furthermore, ""Con todo resuelto, Colom, Rabaseda, Beirán, Juancho y Oriola fue el quinteto asimétrico encargado de gestionar los minutos de la honrilla."" This sentence also lacks proper grammar and contains several ungrammatical structures, making it difficult to read. 

The use of the phrase ""desastróso parcial"" instead of ""partially disastrous"" further illustrates a disregard for standard English grammar. These errors, while not as prevalent or severe as in a lower scoring response, do impede the overall quality of the summary. Therefore, based on the score rubric, this response fails to meet the standard of grammatically correct language and coherent style expected from the given instruction. So the overall score is 2. 
[RESULT] 2",2
gpt4o-5w1h,"The provided response summarizes the main points of the given text accurately. It presents the necessary information such as the purpose of the project, the people involved, the actions taken, and the future intentions. However, the response could have elaborated more on some aspects, such as the impact of the project on the community and the cultural experiences of the group.

In terms of grammar and fluency, the response is well-written with no apparent errors. The sentences are correctly structured, and the language used is appropriate for a summary. This is in line with the requirements of the score rubric, which emphasizes the absence of grammatical and spelling errors and coherence in language usage.

Additionally, the response maintains a clear and concise style throughout, which is essential for a summary. It provides a comprehensive overview without overwhelming the reader with too much detail.

Based on the criteria outlined in the score rubric, the response demonstrates a high level of fluency and accuracy in summarizing the text. Therefore, it earns a score of 5. 
[RESULT] 5",5
gpt4o-5w1h,"The summary effectively conveys the essence of the original text, detailing the context, key participants, and the outcome of the debate. It adheres to the grammar and spelling conventions of the language and maintains a natural flow throughout the summary.

The writer has successfully used language that is both grammatically sound and contextually appropriate, creating a coherent narrative. Each sentence is coherent and contributes to the overall understanding of the topic. Additionally, the language variety and dialect mix is entirely natural and seamless, without causing any discomfort or confusion.

Moreover, the summary manages to capture the complexities and diverse perspectives within the community regarding the pisos turísticos. It is evident that the writer has grasped the intricacies of the subject and presented them in an accessible manner.

In conclusion, the summary displays a high level of fluency and clarity, aligning well with the score rubric's criteria for a well-written text. Therefore, based on the evaluation criteria focusing on grammar, fluency, and coherence, the summary is considered excellent. 
[RESULT] 5",5
gpt4o-5w1h,"The summary is well constructed, maintaining a high level of grammatical accuracy throughout. It presents all the key points from the original text, indicating an effective summary of the complex subject matter. The language is formal and appropriate, maintaining the professional tone of the topic. Each sentence is coherent and logically follows from the preceding one, contributing to the overall clarity and fluidity of the text. The sentence structure is correct, the vocabulary used is suitable and adds to the comprehensibility of the summary. This response meets the criteria set by the score rubric and displays an excellent understanding of the task at hand. Therefore, the response is graded as 5. 
[RESULT] 5",5
gpt4o-5w1h,"The summary presents a clear understanding of the original text, focusing on the key points, such as Colate's accident, his expulsion from the reality show, his subsequent operation, and the support he received from his family and friends. It avoids mixing language varieties, maintaining a natural flow throughout. However, there are minor grammatical issues that could be improved. For example, the phrase ""quien llegaba a España el pasado 3 de julio"" could have been constructed more appropriately, such as ""quien llegó a España el pasado 3 de julio"". These errors do not significantly detract from the overall quality of the summary. Despite the minor issues, the response demonstrates a good grasp of the content, presenting it in a concise and accessible manner. So the overall score is 4. 
[RESULT] 4",4
gpt4o-5w1h,"Upon reviewing the summary, there are no obvious grammatical errors or language variety issues, indicating a high level of fluency and coherence. The sentences are concise and provide a clear and structured summary of the given text. However, there is a minor spelling error where ""Chandrayaan"" should be ""Chandrayaan 2"" for consistency with the original text. Despite this, the overall quality of the summary is commendable, showcasing an understanding of the language conventions and maintaining the appropriate tone and clarity throughout. The summary accurately encapsulates the key aspects of the mission, demonstrating a strong grasp of the subject matter. Therefore, the response fulfills the score rubric's criteria, resulting in a high-quality summary with only minor issues. So the overall score is 4. [RESULT] 4",4
gpt4o-5w1h,"The summary provided adheres well to the rules of grammar and spelling. The sentences are concise and complete, without any formatting or grammatical errors. Each sentence is coherent with the previous, maintaining a logical flow throughout. Additionally, the variety of language used is appropriate, with no evidence of mixing different language varieties or dialects. Therefore, the summary is both grammatically sound and readable, fulfilling the requirements set out in the score rubric. 
[RESULT] 5",5
gpt4o-5w1h,"The response provided a summarized version of the text. It addressed the main points of the original text, including the confirmation of the separation, the reasons behind it, and the impact on their personal and professional lives. However, the summary contained a few grammatical errors. For instance, the phrase ""tanto el cantante como Perera"" should have been ""both the singer and Perera."" Additionally, the response used contractions, like ""la revista ¡Hola!"" which might be considered less formal in some contexts. Despite these minor issues, the overall summary is coherent and follows the appropriate language variety. Therefore, while there are grammatical errors, they are not severely impacting the readability and the summary does meet the criteria of being understandable and mostly error-free. So the overall score is 3. 
[RESULT] 3",3
