model,feedback,score
reka-5w1h,"The response adeptly summarizes the original text, addressing the key elements such as notable figures in speleology, significant discoveries, and details about the complexities and locations of these caves and pits. The use of language in the summary is fluent, and the grammar and spelling are accurate, aligning with the expectations set by the score rubric. The summary is coherent and maintains the thematic continuity throughout, without mixing languages or dialects in an unnatural manner. It effectively conveys the essence of the text in a manner that is easily understandable, fulfilling the purpose of a summary. Therefore, considering the aspects highlighted in the score rubric, the summary is well-crafted, demonstrating a strong command of the language, and there are no significant grammatical or spelling errors. So the overall score is 5. [RESULT] 5",5
reka-tldr,"The summary captures the main points of the text but does so in a slightly simplified manner, which could detract from the richness of the original content. Furthermore, while the summary is grammatically sound, it lacks some of the depth and detail that could provide a more comprehensive understanding of the text. However, these shortcomings do not significantly hinder the reader's ability to grasp the essence of the original text, and the summary is generally well-structured and written in the correct language variety. Therefore, according to the score rubric, the summary would be given a score of 4. The summary's grammar is mostly correct, and while there are some minor details omitted, the overall coherence and fluency are intact. So, despite some minor areas of improvement, the summary successfully conveys the key points of the text in a grammatically sound and coherent manner. 
[RESULT] 4",4
reka-tldr,"The summary provided is grammatically sound and concisely captures the essence of the project undertaken by the five universities. It articulates the objectives, the method of fundraising, and the significance of the project in both Spanish and global contexts. The use of language is appropriate, clear, and engaging, making the narrative easy to follow. The coherence of the language used, the absence of formatting issues or obvious ungrammatical sentences, and the alignment with the grammar and spelling conventions meet the high standards of the score rubric. Therefore, it is evident that the response deserves the highest score due to its excellent quality and the flawless application of language and grammar. 
[RESULT] 5",5
reka-tldr,"The response summarizes the situation where pisos turísticos have been causing a conflict in a historic building in Madrid, resulting in a decision to limit the number of pisos. However, there are several grammatical errors that detract from the overall quality of the summary. For instance, phrases like ""ha generado un conflicto"" and ""nueve votos a favor"" have missing articles (""a"" and ""the"") which could lead to confusion or misinterpretation. Furthermore, the language used in the summary feels somewhat disjointed, lacking the flow and coherence found in a more natural and fluent text. These issues make it difficult to read and comprehend the summary. Therefore, the score for this response is 2 due to the presence of various important grammatical errors and the uncomfortable mixing of language varieties/dialects. 
[RESULT] 2",2
reka-tldr," The response provided a concise summary of the text, focusing on key elements such as the need for safer and more engaging rugby, the role of World Rugby in enforcing new norms, and the implications of these changes. The response maintained a coherent narrative throughout, without any obvious grammatical or spelling errors, thus meeting the requirements of the score rubric. Furthermore, the response successfully avoided language mixing and maintained the language quality throughout, aligning well with the criteria set out in the score rubric. Therefore, the response would receive a score of 5 as it is grammatically correct and uses a coherent variety of the language. 
[RESULT] 5",5
reka-tldr,"The summary provided contains several grammatical errors and inconsistencies. For example, phrases such as ""Después de casi 10 semanas en la isla de Honduras, tuvo que ser operado de la clavícula"" and ""Colate, también fue conocido por su liderazgo y exigencia en las pruebas del programa"" lack proper punctuation and verb agreement, making the text difficult to read. Additionally, there is a mix of informal and formal language, which creates an unnatural flow.

While some sentences are grammatically correct, such as ""Nicolás Vallejo-Nájera, más conocido como Colate, fue el primer concursante confirmado para el reality show 'Supervivientes' de Telecinco,"" the overall quality of the summary does not meet the expected standards of grammar and spelling. As a result, the summary does not convey the intended information effectively.

Considering the score rubric, which prioritizes grammatical correctness and fluidity of language, the response receives a score of 2 due to its numerous grammatical errors and awkward language use. The mix of language varieties/dialects further detracts from the readability and overall coherence of the summary. 
[RESULT] 2",2
reka-tldr,"The summary provided is overall well-written, following the grammar and spelling conventions for the English language. However, there are minor errors and omissions that slightly affect its fluency and completeness. For instance, the phrase ""La misión, que es mayoritariamente de desarrollo indio,"" is grammatically incorrect and should be ""The mission, which is predominantly developed in India."" Additionally, the detail about the spacecraft's initial plan to collaborate with Russia and the subsequent retirement of Russia due to a failed mission is omitted. Despite these issues, the summary does manage to convey the key points of India's Chandrayaan-2 mission effectively. Therefore, while the summary has minor shortcomings, it still manages to communicate the essential information in a relatively fluent manner. This is why it would receive a score of 4 according to the provided rubric, as there are only a few grammatical errors. 
[RESULT] 4",4
reka-tldr,"The response is free of any grammatical or spelling errors, adhering to the language's syntax and vocabulary. It effectively condenses the original text into a concise summary, ensuring the key points are clearly conveyed. Furthermore, the language used in the response is consistent, maintaining a professional and informative tone throughout. This results in a seamless and fluent reading experience, without any awkwardness or incoherence due to language mixing or grammatical missteps. In alignment with the score rubric, the response is well-written and grammatically correct, fulfilling the criteria for a high-scoring summary. Therefore, the response is awarded a score of 5 based on the given rubric. 
[RESULT] 5",5
reka-tldr,"The response is well-structured and coherent, displaying a high level of grammatical accuracy and spelling correctness. The content is summarized effectively without any significant errors, which aligns with the highest standards of the score rubric. The variety of language used is appropriate for the context and maintains a natural flow throughout the summary. Thus, based on the given criteria, the response has no grammatical or spelling errors, which justifies a score of 5. 
[RESULT] 5",5
reka-tldr,"This summary successfully encapsulates the variety of films and their themes, without compromising on grammatical accuracy. It has managed to avoid any major formatting issues, adhering closely to the standards of the language. Each sentence flows logically into the next, making the information digestible for the reader. The summary also maintains a consistent tone, further enhancing its readability and coherence. By avoiding any glaring mistakes in spelling or grammar, it succeeds in presenting the information in an accessible and engaging manner. The consistent use of standard language and avoidance of complex sentence structures makes the summary well-suited to the audience it is intended for. 

The response does not have any errors and maintains coherence throughout, which adheres to the requirements of the score rubric. There is no mixing of language varieties or dialects, which is crucial in maintaining the natural flow of the summary. The language used is appropriate for the intended audience, and the summary manages to cover all necessary points in a concise manner. 

In conclusion, the summary effectively captures the essence of the festival while maintaining linguistic correctness, thereby satisfying the evaluation criteria as outlined in the score rubric. It presents the content in a structured, coherent manner, without any grammatical or formatting errors, making it a high-quality summary. Therefore, the score is 5. 
[RESULT] 5",5
reka-tldr,"The provided summary exhibits a good level of fluency, maintaining the correct use of grammar throughout. It adheres to the conventions of the language, avoiding any significant errors. Moreover, the sentence structures are clear and the vocabulary used is appropriate and coherent with the context of the article. Despite its quality, there are some minor inconsistencies in word choice that slightly reduce the overall flow. For instance, the phrase ""estaban llenas"" would be more accurate as ""estaban rellenas"" for the context of ""full of images"". Additionally, the phrase ""porque compartamos como compartimos"" is awkward and could be improved to match the original text better. Nevertheless, these errors are of lesser importance and do not significantly impede the reader's understanding or detract from the quality of the summary. The use of quotes and examples is also handled effectively, contributing to the clarity and comprehensibility of the summary. Overall, the summary is well-written and demonstrates a strong command of the language. So the score is 4. [RESULT] 4",4
reka-tldr,"This summary is well-written, with no apparent grammatical or spelling errors, which aligns with the score rubric's requirement for fluency. The language used is appropriate for the situation described, providing a clear and concise summary of Pedro Sánchez's current situation. However, the response could have offered more details about the events and criticisms faced by Sánchez during his stay at the palace, as it only briefly mentions the criticism from the opposition and the reunions with social and economic groups. Furthermore, while the use of language is coherent, the summary could have been improved by incorporating more context about Sánchez's political strategies and challenges in forming a new government. Nonetheless, due to its good fluency and grammar, and minor omissions, the response satisfies the criteria for a score of 4. 
[RESULT] 4",4
reka-tldr,"Upon review, the response demonstrates good command of the language used. It is grammatically correct and free of any formatting or capitalization errors, making it easy to read. The summary follows a logical flow and summarizes the key aspects of the original text, including the project's goals, the fiscal aspects, and the proposed regulations on parking. It also correctly identifies the main characters involved and their roles. The response manages to convey all the relevant information in a succinct manner without losing the essence of the original text. Therefore, according to the score rubric focusing on fluency and grammar, this summary earns a full score of 5. 
[RESULT] 5",5
reka-tldr,"The summary effectively covers the main points of the announcement regarding Beatriz de York's engagement to Edoardo Mapelli Mozzi. The response contains several grammatical mistakes, which detract from the overall fluency of the text. For example, phrases like ""Mapelli Mozzi es un rico empresario dedicado al negocio inmobiliario en Londres"" are grammatically incorrect. The language used in the summary is consistent, but the mix of language varieties is somewhat awkward, which may confuse the reader. While the content of the summary is largely accurate, the errors present make the text more difficult to read. Consequently, the summary does not fully meet the criteria for fluency and grammatical correctness as outlined in the score rubric. So the overall score is 2. [RESULT] 2",2
reka-tldr,"The summary presented here is clear, coherent, and grammatically accurate, effectively condensing the main points of the original text. It contains no major grammatical mistakes, formatting issues, or unnatural mixes of language, which adheres to the highest standards set out in the score rubric. It is concise yet comprehensive, managing to convey all the essential details without sacrificing clarity or coherence. Therefore, based on the provided criteria, this response deserves a full score as it successfully achieves the goal of summarizing the text while maintaining a high standard of language quality and fluency. 
[RESULT] 5",5
reka-tldr,"The summary provided here is well-written, with a good grasp of language and grammatical structure, making it easy to follow. It addresses the main points of criticism regarding Ursula von der Leyen's nomination for the presidency of the European Commission, including the process of selection, her lack of experience and popular support, and the concession made to the V4. However, there are a couple of minor grammatical issues that slightly impact the overall fluency, such as a repetition of the term 'gobiernos' in the first point and a less formal tone in certain places. The summary also manages to convey the key arguments and questions surrounding Von der Leyen's candidacy and the implications of the EU's current governance structure, though it could provide more details on her positions and the V4's stance on democratic norms. Despite these minor shortcomings, the summary maintains a clear and concise message, aligning with the grammatical and spelling conventions of the language. So the overall score is 4. [RESULT] 4",4
reka-tldr,"Upon reviewing the response, it is evident that the summary presented is grammatically sound and coherent. The sentences flow logically, and the language used is both appropriate and engaging. The respondent has effectively encapsulated the main themes and key elements of the original text, such as the comedic nature of the play, the central conflict regarding the parentage of the couple, and the roles played by the principal actors. It also touches upon the modern elements, like the use of telecomedies and the digital pastel of the bodies, which were significant to the story. This demonstrates a clear understanding of the source material, and the summary provided is coherent and well-structured, closely adhering to the grammatical and stylistic requirements set forth in the scoring rubric. In conclusion, due to its accurate and fluent translation, devoid of any noticeable grammatical errors or awkward language mixing, the response effectively meets the highest standards outlined in the score rubric. Therefore, a score of 5 is warranted. 
[RESULT] 5",5
reka-tldr,"The response does an adequate job summarizing the text. However, it contains minor grammatical errors such as ""Sin embargo"" which could be more accurately expressed as ""However, the movie"" to maintain better fluency. Additionally, the phrase ""debido a su reparto joven"" could be replaced with ""due to its youthful cast"" to improve clarity and coherence. Despite these issues, the overall structure and content of the summary are coherent and align well with the original text. It accurately captures the essence of ""The King"", acknowledging its connection to Shakespeare and the strong shakespearean style it employs. It also successfully identifies the potential misconception regarding the movie's adaptation of the source material. However, these minor flaws prevent the response from achieving a perfect score in terms of grammar and fluency. 

So the overall score is 4 because the summary is grammatically mostly correct, but it does contain a few grammatical errors and awkward language choices that detract slightly from the readability and natural flow of the text. 
[RESULT] 4",4
reka-tldr,"The response provided is mostly clear and coherent, addressing the primary points of the original text: the supervision of NO2 and O3 limits in the Community of Madrid, the main causes of this pollution, and the involvement of the European Commission. The response is free of significant grammatical errors, but it lacks detail and context compared to the full version of the original text. For example, it omits the time frame of when the limits were superceded and does not mention the specific stations that exceeded the limits. Despite these omissions, the response is still a valid summary that adheres to the language and grammatical standards required. The tone of the summary is consistent and does not mix dialects or language varieties in an unnatural manner. Therefore, it can be said that the summary is well-written and accurate, though it could benefit from a greater level of detail and context. So the overall score is 4. [RESULT] 4",4
reka-tldr," This summary effectively encapsulates the main points of the original text. The grammar and spelling in the summary are correct, and the language variety used is coherent, demonstrating a good understanding of the content. It provides an overview of the key points: the importance of seasonal produce, nutritional recommendations for different groups, and the practical aspect of preparing quick, healthy meals. Furthermore, it mentions the role of Inés Ortega and her niece, Marina Rivas, and their respective backgrounds in the culinary field. It also includes the number of recetas, reflecting the breadth of the book. The information presented is concise and relevant, meeting the expectations outlined in the score rubric. In conclusion, the summary is well-written, adhering to the grammar and spelling conventions of the language and does not include any unnatural or uncomfortable grammatical errors, which aligns with the highest score of the rubric. 
[RESULT] 5",5
reka-tldr,"The summary is well constructed with no significant grammatical errors. The sentences are clear and fluently written. However, there are some minor issues that slightly detract from the overall clarity and grammar. For example, the phrase ""el lobo solitario"" could have been replaced with a more commonly understood expression like ""the lone wolf"" to improve comprehension. Additionally, the summary could have used more precise language when referring to the parties involved in the extradition process. Despite these minor flaws, the summary largely maintains the grammatical integrity expected from a well-written piece of writing. Therefore, based on the scoring rubric, which prioritizes fluency and the absence of grammatical errors, the summary is generally of high quality, with only slight imperfections. 
[RESULT] 4",4
reka-tldr," This summary provides a coherent narrative that follows the theme of the text. It encapsulates the significance of the senses, particularly the olfato, in the functioning and survival of living organisms. The response effectively utilizes the language, demonstrating an understanding of the subject matter. However, there are minor issues with grammar, such as missing verb conjugations, which slightly disrupt the flow of the text. Additionally, the transition from one point to another is sometimes abrupt, which can affect the overall fluency of the summary. These small imperfections are why this summary receives a score of 4 rather than a perfect score of 5. Despite these minor issues, the response remains largely error-free, using the appropriate language variety and maintaining the required quality throughout. Therefore, despite the minor shortcomings, this summary is still of high quality and conveys the key points of the text with clarity and precision. 
[RESULT] 4",4
reka-tldr,"The provided response, while adequately summarizing the main points of the original text, does so in a manner that occasionally falls short of the desired fluency and grammatical precision. For example, there is an unnatural pause between ""Import Vídeo"" and ""Madrid,"" which disrupts the flow of information and can be perceived as a grammatical error. Furthermore, the phrase ""A pesar de la transición, sigue valorando..."" is somewhat awkwardly constructed, suggesting a less fluid understanding of the original text. The mention of the shift to online platforms is also somewhat simplistic and lacks the nuance and detail found in the original text. However, despite these minor issues, the summary maintains coherence throughout, with no major errors or issues. It effectively encapsulates the essence of the text, reflecting the experiences and thoughts of Fernanda Navarro as he reminisces about his career and the changing landscape of the movie industry. Based on these observations, it is clear that the summary adheres closely to the score rubric's criteria for a score of 4, where few grammatical errors are present. The summary could be further improved by addressing the minor awkwardnesses and by adding more detail about the cultural implications of the changing movie industry. So the overall score is 4. [RESULT] 4",4
reka-tldr,"The response demonstrates a good understanding of the text, maintaining the essence of the information. However, there are some grammatical issues and the use of contractions, which might affect the overall fluency and clarity. For example, the phrase ""adquirida Alestis para crecer y ser más competitivo en el sector aeronáutico"" could be better articulated as ""adquirida Alestis para crecer y ser más competitivo en el sector aeronáutico"". Additionally, the sentence structure seems a bit off in places, making it harder to follow the text flow. The response also lacks details about the specific impacts of the merger and how the issue of Alestis's debt is being addressed, which are crucial points mentioned in the original text. In terms of language use, the summary is mostly coherent and the variety of language is well-presented, although there are a couple of instances where the language could be more natural. Based on the score rubric, these are minor errors that do not significantly hinder the summary's readability and overall quality. So, the score is 4. [RESULT] 4",4
reka-tldr,"The summary provided is grammatically correct, concise, and directly addresses the key points of the original text. It successfully captures the increase in tourists to Spain and highlights the disparity in tourism growth among different regions. However, it misses out on mentioning the causes for the decrease in tourist numbers, especially from the UK, which is a significant aspect of the text. Additionally, while the summary provides a brief overview of the changes in tourism patterns, it could have offered more specific details, such as the percentages of growth in various regions. Nonetheless, the language used is coherent and follows the conventions of the language without any significant grammatical errors. So, the response gets a score of 4 due to its overall coherence and clarity, despite the lack of some important details from the text. 
[RESULT] 4",4
reka-tldr,"The response provides a condensed summary of Lisa Ann's role in interpreting Sarah Palin in various films, her political involvement, and her recent return to the adult film industry. It maintains a logical flow, however, it fails to fully capture the nuances of Lisa Ann's career and the cultural context in which she gained fame. For example, the response omits the fact that Lisa Ann was first cast as Sarah Palin in ""Who's Nailing Paylin?"" during the 2008 presidential campaign. It also does not mention the controversy surrounding the film or its status as a parody with specific political references. The summary does not incorporate grammatical errors or mixes in language use, aligning with the grammatical and spelling conventions. It remains well-written throughout, reflecting the text's high fluency. However, there is room for improvement in terms of depth and contextualization, particularly concerning Lisa Ann's transformation into a gurú of a popular online game. The summary could also elaborate more on Lisa Ann's activism in the adult film industry. Overall, despite the lack of errors in language use and grammar, the response does not fully capture the richness of the original text. Therefore, while the response demonstrates a good level of grammatical fluency, it lacks the depth and comprehensiveness that would fully align with a score of 5. 
[RESULT] 4",4
reka-tldr,"The summary provided is clear, concise, and grammatically correct, effectively distilling the information from the original text. The language used is coherent, without any formatting problems, capitalization errors, or ungrammatical sentences that might impede readability. It manages to maintain the same meaning as the original text, summarizing the key points about the red ferroviaria catalana's issues with independent groups. The incorporation of significant facts such as the economic damage, the risks for passengers and staff, the incidents, and the Girona focus adds to the completeness of the summary. Therefore, the summary fulfills the criteria for a high-quality summary, as defined by the score rubric. It demonstrates a good understanding of the original text, presenting it in a well-structured and error-free manner. So the overall score is 5. 
[RESULT] 5",5
