model,feedback,score
commandr-base,"The response provides a good summary of the text, covering the key points about the evolution of Chilean wine production and the significance of certain grape varieties and wineries. The response adheres to the grammatical and spelling conventions of the language, and there are no apparent errors in the text. The summary captures the essence of the original text and presents it in a coherent and natural manner, effectively reflecting the tone and content of the source material. It demonstrates an understanding of the language and uses it appropriately. This careful attention to detail in both grammar and content ensures that the summary meets the highest standards set by the rubric. Therefore, based on the given score rubric, the response exhibits no grammatical or spelling errors and the language variety used is coherent, which aligns with the requirements for a score of 5. 
[RESULT] 5",5
commandr-base,"The summary is well-structured and follows the language conventions for grammar and spelling, indicating a high degree of fluency. It captures the essential details of the text: the sale of 94,69% of Media Capital to Cofina, the value of the sale, the intent to use the proceeds for debt repayment, and the general structure of the companies involved. Additionally, the summary effectively communicates the strategic implications of the transaction for both PRISA and Cofina. It maintains a coherent and professional tone throughout, aligning with the language's typical business communication style. In conclusion, based on the score rubric, there are no notable grammatical or spelling errors, nor is there any mixing of language varieties or dialects, making the text easy to read and understand. So the overall score is 5. [RESULT] 5",5
commandr-base,"The summary is well constructed and lacks any significant grammatical errors. The sentences are fluent and follow standard sentence structure, which makes it easy to understand the summary. The variety of language used is appropriate and does not mix different dialects or styles in a way that would make it difficult to read. Moreover, the summary provides a clear and concise summary of the situation without unnecessary details, adhering closely to the original text. Therefore, the summary meets all the criteria outlined in the score rubric for fluency and grammar. So the overall score is 5. [RESULT] 5",5
commandr-base,"The summary presented captures the main points of the complex issue at hand but does so with a few grammatical and syntactical errors that detract from the clarity and flow of the text. For instance, phrases such as ""pacto legítimo"" and ""triste espectáculo"" appear as direct translations, which slightly disrupts the natural flow of English. Additionally, the use of certain phrases, like ""subasta"" for ""auction"", and ""operación de marketing considerable"" for ""marketing operation of considerable magnitude"", may be a bit more formal than what might be expected in a contemporary political discussion, thus deviating slightly from the intended informal tone. However, these issues do not significantly undermine the overall quality of the summary and it largely maintains the original context and intent. The response demonstrates an understanding of the issue, but could benefit from smoother language and sentence structure to better convey the intricacies of the conflict. 

So the overall score is 4 due to the presence of a few grammatical errors and some awkward word choices, although the content and the overall story are clear and accurate. These minor issues do not greatly hinder the reader's comprehension, but do affect the fluency and naturalness of the text. 
[RESULT] 4",4
commandr-base,"This response demonstrates a commendable command over English language constructs, delivering a well-structured summary. The language used is coherent and avoids mixing dialects, which could be confusing. The sentences are grammatically correct and there are no formatting problems. Additionally, the response is succinct yet comprehensive, encapsulating the essence of the original text while maintaining a fluent flow. The use of specific details from the original text, such as the financial success of Disney's films and the company's strategic acquisitions, further enhances the quality of the summary. Therefore, based on the given rubric, the response excels in terms of fluency and adherence to grammatical and spelling conventions. 
[RESULT] 5",5
commandr-base,"The summary reflects a comprehensive understanding of the text provided, covering the key sentiments and perspectives expressed by the different personalities involved. It appropriately captures the sense of disappointment and frustration felt by the artists, writers, and intellectuals, as well as their observations on the political environment. 

However, while the summary does not present any major grammatical or spelling errors, there are certain instances where the language could have been refined further. For example, the phrase ""expresan su amargura y su desengaño ante la incapacidad"" could have been more elegantly phrased to avoid the slightly awkward structure. Additionally, the use of phrases such as ""los votantes de izquierda seguimos apostando por ello"" might not fully convey the depth of the subject matter, which is critical for a comprehensive understanding. 

Nevertheless, these are relatively minor issues and do not significantly affect the overall quality of the summary. The coherence of the language and the ability to convey the content of the text in a concise manner is commendable. Thus, according to the score rubric, which emphasizes the absence of grammatical and spelling errors and the coherence of the language, the response demonstrates a high level of fluency and adherence to the linguistic norms, therefore, it would receive a score of 4. 
[RESULT] 4",4
commandr-base,"The response is coherent and mostly free of grammatical or spelling errors. It captures the essence of the text, highlighting some of the most famous underground locations such as the Krúbera-Voronya, Dark Star, and the Picos de Europa's torca del Cerro del Cuevón. However, there are a few minor issues. The phrase ""con 250 metros de altura"" seems out of place, as it is not mentioned in the original text. Additionally, the sentence ""Además, se mencionan las cavernas de Wang Dong en China"" could be rephrased to avoid the repetition of ""en China."" Despite these minor errors, the overall fluency of the summary is maintained, and the content is summarized accurately. Therefore, considering the grammatical accuracy and the overall comprehensibility, the response would receive a score of 4. 
[RESULT] 4",4
commandr-cot,"The response given shows a basic understanding of the text, summarizing the key points of Spain's loss to Russia in their preparation for the World Cup. However, there are several grammatical errors, which make the response less fluid and harder to read. For example, the use of ""perdiendo"" is incorrect; ""perdida"" would be more appropriate. Furthermore, the response fails to maintain the coherence of the language, with sentences that do not smoothly connect the ideas being expressed. This lack of coherence disrupts the flow of the summary.

In addition, the use of language in this response is somewhat unnatural and uncomfortable, making it hard to follow the main ideas. The mix of language varieties and dialects, such as the informal ""se han convertido a un tiempo en metrónomo,"" is not smooth and can lead to confusion. These aspects of the response detract from the overall quality and fluency of the text.

Considering these points, it is clear that the summary does not meet the standards for fluency and grammatical accuracy. The response contains several important grammatical errors and mixes language varieties/dialects in an unnatural and uncomfortable way, which makes it difficult to read. As such, the summary falls short of achieving a higher score according to the provided score rubric. So the overall score is 2. [RESULT] 2",2
commandr-cot,"This response demonstrates a good level of fluency and proper grammatical usage, closely following the conventions of the Spanish language. The narrative is engaging, presenting a clear and coherent summary of the project undertaken by the five university students. There are minor errors such as the phrase ""el virus del valle"" which could be more accurately translated as ""the valley disease,"" but these do not detract significantly from the overall quality of the text.

The summary is structured well, outlining the steps taken by the students from the organization of the solidarity event to their visit to Marruecos and their experiences there. The text flows logically, transitioning smoothly from one point to the next, thereby enhancing its readability. The use of direct quotes and personal anecdotes adds depth to the narrative, painting a vivid picture of the students' journey and their efforts to better the lives of the people in Tasslent.

Despite its minor flaws, this summary aligns closely with the criteria outlined in the score rubric. The errors are few and do not disrupt the flow of the text, and the use of the Spanish language is appropriate and coherent throughout. Thus, based on these observations, the summary achieves a score of 4 according to the rubric provided. 
[RESULT] 4",4
commandr-cot,"The summary is well-structured and provides a succinct overview of the scenario presented. The language used is correct and natural, with no significant grammatical errors. The mix of language varieties is seamless, making it easy to understand. The summary captures the key aspects of the discussion among the vecinos, including the implications of the real decreto, the motivations of different stakeholders, and the outcomes of the vote. Moreover, the use of transition phrases and connectors enhances the flow of the text. It maintains a consistent level of formality and clarity throughout, adhering to the standards of good writing. Therefore, the summary effectively summarizes the text while meeting the criteria for a score of 5 according to the score rubric. 
[RESULT] 5",5
commandr-cot,"The summary provided does not display any significant grammatical errors or spelling issues, thus meeting the requirement for a coherent and well-written text as per the scoring rubric. It accurately captures the essence of the text and presents the information in a way that is easy to understand.

However, the summary could have been enhanced by providing more detailed explanations of the changes in rugby norms and their implications. For instance, while it mentions that the 2023 World Rugby would not be affected by the new regulations, it could have specified which changes would be applied and what their purpose is. Additionally, the summary briefly discusses the impact of these changes on the sport's spectatorship but does not delve into how they might alter the dynamics of the game.

Despite these areas for improvement, the overall fluency and coherence of the summary are commendable. Therefore, considering the quality of the individual sentences, the absence of formatting problems, capitalization errors or ungrammatical sentences, and the clear and concise presentation of the content, the summary fulfills the requirements of the scoring rubric. So the overall score is 5. [RESULT] 5",5
commandr-cot,"The summary of the text provided by Nicolás Vallejo-Nájera's journey on ""Supervivientes"" contains several grammatical and syntax errors. For example, phrases such as ""fue operado de la clavícula"" and ""los primeros chequeos médicos en Honduras indicaban que podía continuar con el concurso"" have improper verb tenses and grammar. These errors make the text difficult to read, as they affect the flow and comprehensibility of the summary. Moreover, the summary does not adhere to the language variety and dialect expected in a high-quality summary, which further detracts from its quality. Therefore, it is clear that the response does not meet the criteria of fluency and proper language use as per the score rubric. 
[RESULT] 1",1
commandr-cot,"This response demonstrates a strong grasp of the language used and provides a concise summary of the text, effectively communicating the key points of the mission. It maintains grammatical correctness throughout, without any errors or fragments that would impede understanding. The language used is also appropriate for the topic at hand, indicating a clear comprehension of the subject matter. It fulfills the criteria of the score rubric by being well-written and devoid of any formatting problems or unnatural and uncomfortable mixes of language. As such, the response would earn a full score of 5 according to the rubric's emphasis on fluency and grammatical accuracy. 
[RESULT] 5",5
commandr-cot,"The summary of the original text is fluent and correct, with no grammatical errors or inaccuracies. The response successfully condenses the necessary details without losing any important information. It is coherent, and the sentence structure adheres to standard conventions for the Spanish language. Each sentence flows logically into the next, with clear subject-verb relationships and appropriate use of past tense verbs to reflect the sequence of events in the original text. Therefore, according to the score rubric focusing on fluency and grammatical correctness, this response fulfills the criteria for a score of 5. 
[RESULT] 5",5
commandr-cot,"Upon examination, the response provided does not meet the highest standard of grammatical correctness, resulting in a few grammatical errors. Although the errors are not as severe as those in the lower scoring categories, their presence means the summary is not entirely free from linguistic issues. For instance, there is a lack of punctuation in some sentences which could potentially disrupt the flow of the text. In addition, the structure of the sentences sometimes feels slightly less natural than would be expected in standard English. However, the response does contain coherent sentences and manages to convey the essential information about the separation of the couple and the subsequent events in their lives. Despite these minor imperfections, the response still manages to communicate the key details of the text effectively, and for this reason, the overall quality of the summary is deemed to be satisfactory. 

So the score is 4 because, while there are a few grammatical errors, the majority of the summary is correctly constructed and easily understandable. It meets the criteria for a good level of grammar and fluency. 
[RESULT] 4",4
commandr-cot,"The response is concise and well-structured, effectively summarizing the complex text. It successfully highlights the key elements of the festival, including its variety and the emotional depth of the films. However, it lacks specificity in its description of the movies and their respective dates of projection, which could have enhanced the understanding of the festival's schedule. Nevertheless, the response is free of grammatical and spelling errors, maintaining a coherent and fluent flow of information, in line with the grammar and spelling conventions for the language. Therefore, it aligns well with the scoring rubric criteria, receiving a score of 5. 
[RESULT] 5",5
commandr-cot,"The response accurately summarizes the main points of the original text, reflecting an understanding of the topic of 'sharenting' and its implications. It outlines the reasons behind this practice, the associated risks, and the stance taken by experts like Stacey Steinberg and Nathan Freitas. Furthermore, it touches on the emotional aspect, the importance of considering the child's opinion, and the various factors that contribute to this trend. The response demonstrates coherence and grammatical accuracy, without any formatting problems, capitalization errors, or obviously ungrammatical sentences. Therefore, based on the given score rubric focusing on fluency and grammatical correctness, the response is a well-written summary that meets the required standards for language use and readability. 
[RESULT] 5",5
commandr-cot,"The response effectively summarizes the main points of the text, capturing Pedro Sánchez's actions, his decision to stay at the Palacio de las Marismillas, and the opposition's reaction. However, there are minor grammatical errors that affect the overall fluency of the response. For instance, the phrase ""descansa en el Palacio de las Marismillas"" could be more accurately expressed as ""is resting at the Palacio de las Marismillas."" Furthermore, the response could benefit from additional detail, such as the fact that there have been 14 meetings with colectives sociales and económicos in the last seven days, which contributes to the understanding of the level of activity for Sánchez. This additional detail would improve the summary by providing a clearer picture of Sánchez's actions and concerns during his time at the Palacio de las Marismillas. Overall, while the response is grammatically correct, the inclusion of more precise information would elevate the quality of the summary. Therefore, the response would be scored at 4. 
[RESULT] 4",4
commandr-cot,"The summary is presented in a clear, grammatically correct manner without any significant language errors or mixing of language varieties/dialects. It captures the essential aspects of the text, such as the introduction of variable parking tariffs and the overall goal of reducing contamination. The summary is concise and easy to read, adhering to the conventions of standard English. There is a good flow of ideas, with a logical progression from the introduction of the project to its implementation and potential impact. Therefore, the summary is a strong example of fluency, meeting the standards outlined in the score rubric. 
[RESULT] 5",5
commandr-cot,"The summary provides an overview of the princess's engagement but lacks some details that could enhance the quality of the summary. For example, the summary does not mention the ages of the couple, Beatriz de York being 31 years old and Edoardo Mapelli Mozzi being 35 years old. It also does not detail the nature of the relationship between Mapelli Mozzi and the late millionaire, Jeffrey Epstein. Additionally, the summary doesn't provide any context regarding the couple's backgrounds, such as Mapelli Mozzi being an Italian entrepreneur with a passion for the opera and dogs, and Beatriz de York's position as the ninth in the line of succession to the British throne. While the summary is grammatically correct and contains no errors, it could be improved with more comprehensive details about the couple, the circumstances of their relationship, and the current situations they find themselves in. Therefore, while the summary meets the basic requirements of the rubric, it falls short in providing a fuller picture of the events, as would be expected from a high-quality summary. This analysis, considering the importance of detail in a summary, leads to a score of 3. [RESULT] 3",3
commandr-cot,"The summary is grammatically sound and does not contain any spelling errors. It effectively condenses the information from the original text, focusing on the key elements of the story such as the closing of the investigation, the reason behind it, and the implication for Neymar. The sentence structure is coherent, and the language is appropriate for the context. However, there are several aspects of the summary that could have been elaborated further, such as the details about the version of events and the impact on Neymar's career. Nevertheless, these omissions do not significantly detract from the overall quality of the summary. Therefore, the summary meets the requirements of the score rubric by presenting the information in a concise and coherent manner without any formatting problems or grammatical errors. 
[RESULT] 5",5
commandr-cot,"The response effectively summarizes the criticisms surrounding the proposal of Ursula von der Leyen as president of the Comission Europea. The language is fluent and the summary adheres to the grammatical and spelling conventions of the language. It correctly highlights the lack of transparency and the potential influence of political interests, which are key points in the original text. However, the response misses a few details such as the specific critique of von der Leyen's preparation for the position and the mention of the four nations of the Visegrad alliance. These details were clearly stated in the original text and their omission could impact the comprehensiveness of the summary. Nevertheless, the response maintains a high level of fluency and grammatical correctness throughout. Therefore, while the response does provide a succinct summary, there are minor omissions that could have been included for a more complete representation of the original text. So the overall score is 4. 
[RESULT] 4",4
commandr-cot,"The response is well written and lacks any noticeable grammatical errors. It succinctly summarizes the key points of the provided text without compromising the essence of the original work. It demonstrates a good understanding of the subject matter and conveys it in a concise and clear manner. The use of the language is coherent and appropriate, with no signs of mixing different language varieties or dialects. It is an accurate and efficient summary, making it very readable. Therefore, the response meets all the criteria set by the score rubric and hence is worthy of a score of 5. 
[RESULT] 5",5
commandr-cot,"The response presents a well-structured and concise summary of ""The King"", successfully avoiding important grammatical errors. The summary adheres to the established language variety, using formal and literary language appropriate for a film discussion. It highlights key aspects of the movie such as the lead characters and the Shakespearean influence on the film. The response effectively communicates the essence of the film, giving an overview of its relevance and appeal to the younger audience. Additionally, it maintains the balance between a brief overview and a more insightful commentary on the film's themes and significance. Therefore, based on the rubric criteria, the response is free from grammatical or spelling errors and demonstrates a good use of language variety. So the overall score is 5. [RESULT] 5",5
commandr-cot,"The response provides a clear and concise summary of the given text. It captures the essence of the issue at hand: the high levels of pollutants in Madrid and its surrounding areas, and it mentions the relevant details such as the Superior Court of Justice's decision and the involvement of the European Commission. The language used in the response is coherent and appropriate for a professional context, which demonstrates a strong adherence to the grammatical and spelling conventions for the language. The absence of any formatting problems, capitalization errors, or ungrammatical sentences in the response further indicates that it meets the criteria for fluency and readability. Therefore, according to the score rubric, this response demonstrates a high level of quality in terms of grammar, fluency, and appropriateness of language. 
[RESULT] 5",5
commandr-cot,"The summary is well-constructed and adheres to the grammatical and spelling conventions of the language. It captures the essence of the original text without resorting to any grammatical errors or awkward mixes of language varieties. The response maintains a professional tone and provides a comprehensive view of the book, its authors, and its content. The inclusion of important details such as the authors' backgrounds, the focus on seasonal ingredients and health, and the variety of included dishes shows a good understanding of the material. The response also reflects an awareness of the target audience of the book, which is evident in the mention of ""una dieta saludable y equilibrada"". Moreover, the use of direct quotations from the original text contributes to the overall quality of the summary. The fluency and the absence of any formatting problems or capitalization errors meet the highest standard of the score rubric. So the overall score is 5. [RESULT] 5",5
commandr-cot,"The summary is grammatically sound and does not mix language varieties or dialects in an uncomfortable way. It maintains a professional tone throughout and is composed of individual sentences that flow naturally. The summary adheres to the English language's conventions and presents information in a clear and structured manner. However, there are minor shortcomings such as missing some specifics from the original text, like the full list of victims and the specifics of the cartel with the leyenda in Mexico. While the summary adequately covers the main points of the original text, it lacks some detail which could have added depth to the summary. Nonetheless, these omissions are not significant enough to undermine the overall quality of the summary. So, while the summary meets most of the criteria, there is room for improvement in terms of completeness. Therefore, the summary has been rated a 4 on the fluency score rubric. 
[RESULT] 4",4
